{
  "$schema": "https://json-schema.org/draft/2020-12/schema",
  "type": "object",
  "required": ["id", "name", "summary", "status", "category", "version", "homepage", "path", "manifest", "source", "capabilities", "tags", "risk", "install", "validation"],
  "additionalProperties": false,
  "properties": {
    "id": {
      "type": "string",
      "minLength": 1
    },
    "name": {
      "type": "string",
      "minLength": 1
    },
    "summary": {
      "type": "string",
      "minLength": 1
    },
    "status": {
      "type": "string",
      "enum": ["local", "available", "installed", "deprecated", "blocked"]
    },
    "category": {
      "type": "string",
      "minLength": 1
    },
    "version": {
      "type": "string",
      "minLength": 1
    },
    "homepage": {
      "type": "string",
      "format": "uri",
      "minLength": 1
    },
    "path": {
      "type": "string",
      "minLength": 1
    },
    "manifest": {
      "type": "string",
      "minLength": 1
    },
    "source": {
      "type": "object",
      "required": ["type", "url"],
      "additionalProperties": false,
      "properties": {
        "type": {
          "type": "string",
          "enum": ["local", "git", "archive", "registry"]
        },
        "url": {
          "type": "string"
        }
      }
    },
    "capabilities": {
      "type": "array",
      "items": {
        "type": "string"
      }
    },
    "tags": {
      "type": "array",
      "items": {
        "type": "string"
      }
    },
    "risk": {
      "type": "string",
      "enum": ["low", "medium", "high"]
    },
    "install": {
      "type": "object",
      "required": ["type", "instructions"],
      "additionalProperties": false,
      "properties": {
        "type": {
          "type": "string",
          "minLength": 1
        },
        "instructions": {
          "type": "array",
          "items": {
            "type": "string"
          }
        }
      }
    },
    "validation": {
      "type": "object",
      "required": ["commands"],
      "additionalProperties": false,
      "properties": {
        "commands": {
          "type": "array",
          "items": {
            "type": "string"
          }
        }
      }
    }
  }
}
