{
  "id": "ai-utilities",
  "name": "AI Utilities",
  "summary": "Author and vet Claude Code extensions (skill-creator, skill-review) and close the plan-to-implementation loop (plan-completion-audit, audit-resolver).",
  "status": "local",
  "category": "Developer Tools",
  "version": "0.2.1",
  "homepage": "https://weblifter.com.au",
  "path": "ai-utilities",
  "manifest": "ai-utilities/.codex-plugin/plugin.json",
  "source": {
    "type": "local",
    "url": ""
  },
  "capabilities": [
    "skills",
    "commands",
    "hooks",
    "scripts",
    "schemas"
  ],
  "tags": [
    "utilities",
    "skill-authoring",
    "skill-review",
    "plan-audit",
    "audit-resolver",
    "review",
    "plugin-review"
  ],
  "risk": "medium",
  "install": {
    "type": "local-path",
    "instructions": [
      "Use the plugin from the local ai-utilities directory.",
      "Codex discovers this plugin through .agents/plugins/marketplace.json at the johns-os root.",
      "audit-resolver applies code fixes and gates every fix behind explicit confirmation; plan-completion-audit is read-only and writes a report.",
      "Validate with python scripts/johns-os-marketplace.py validate before use."
    ]
  },
  "validation": {
    "commands": [
      "python scripts/johns-os-marketplace.py validate",
      "python -m unittest discover -s ai-utilities/tests"
    ]
  }
}
