{
  "id": "engineering-lifecycle",
  "name": "Engineering Lifecycle",
  "summary": "Move software products through a structured engineering lifecycle from discovery to maintenance.",
  "status": "local",
  "category": "Developer Tools",
  "version": "0.10.3",
  "homepage": "https://weblifter.com.au",
  "path": "engineering-lifecycle",
  "manifest": "engineering-lifecycle/.codex-plugin/plugin.json",
  "source": {
    "type": "local",
    "url": ""
  },
  "capabilities": [
    "skills",
    "agents",
    "hooks",
    "schemas",
    "deterministic-scripts",
    "lifecycle-artifacts"
  ],
  "tags": [
    "engineering",
    "lifecycle",
    "architecture",
    "product",
    "testing",
    "release",
    "repo-hygiene"
  ],
  "risk": "low",
  "install": {
    "type": "local-path",
    "instructions": [
      "Use the plugin from the local engineering-lifecycle directory.",
      "Codex discovers this plugin through .agents/plugins/marketplace.json at the johns-os root.",
      "Validate with python engineering-lifecycle/bin/eng-life validate before use."
    ]
  },
  "validation": {
    "commands": [
      "python engineering-lifecycle/bin/eng-life validate",
      "python -m unittest discover -s engineering-lifecycle/tests"
    ]
  }
}
